{
  "schemaVersion": "1.0.0",
  "kind": "enchantmentDefinition",
  "enchantmentDefinitionId": 2,
  "name": "Precision Sight",
  "category": 3,
  "rarityTier": 2,
  "maxLevel": 3,
  "enabled": true,
  "metadataRevision": 1,
  "verificationStatus": "confirmed",
  "notes": "Synced from live CityEnchantments.",
  "bonuses": [
    {
      "level": 1,
      "values": {
        "critChanceBpsBonus": 40,
        "accuracyBpsBonus": 150,
        "rangeBonus": 1
      }
    },
    {
      "level": 2,
      "values": {
        "critChanceBpsBonus": 80,
        "accuracyBpsBonus": 300,
        "rangeBonus": 2
      }
    },
    {
      "level": 3,
      "values": {
        "critChanceBpsBonus": 120,
        "accuracyBpsBonus": 450,
        "rangeBonus": 3
      }
    }
  ]
}
