{
  "schemaVersion": "1.0.0",
  "kind": "enchantmentDefinition",
  "enchantmentDefinitionId": 3,
  "name": "Durability Seal",
  "category": 5,
  "rarityTier": 1,
  "maxLevel": 3,
  "enabled": true,
  "metadataRevision": 1,
  "verificationStatus": "confirmed",
  "notes": "Synced from live CityEnchantments.",
  "bonuses": [
    {
      "level": 1,
      "values": {
        "maxDurabilityBonus": 20,
        "stabilityBonus": 2
      }
    },
    {
      "level": 2,
      "values": {
        "maxDurabilityBonus": 40,
        "stabilityBonus": 4
      }
    },
    {
      "level": 3,
      "values": {
        "maxDurabilityBonus": 70,
        "stabilityBonus": 6
      }
    }
  ]
}
