{
    "schemaVersion": "1.0.0",
    "kind": "enchantmentDefinition",
    "enchantmentDefinitionId": 1,
    "name": "Fire Edge",
    "slug": "fire-edge",
    "description": "Damage-focused enchantment that increases weapon damage while adding heat generation in the live Inpinity City system.",
    "category": 1,
    "rarityTier": 2,
    "maxLevel": 3,
    "bonuses": [
      {
        "level": 1,
        "values": {
          "minDamageBonus": 2,
          "maxDamageBonus": 4,
          "heatGenerationBonus": 1
        }
      },
      {
        "level": 2,
        "values": {
          "minDamageBonus": 4,
          "maxDamageBonus": 7,
          "heatGenerationBonus": 2
        }
      },
      {
        "level": 3,
        "values": {
          "minDamageBonus": 6,
          "maxDamageBonus": 10,
          "heatGenerationBonus": 3
        }
      }
    ],
    "metadataRevision": 1,
    "enabled": true,
    "verificationStatus": "confirmed",
    "notes": "Confirmed from live CityEnchantments enchantmentDefinitionOf(1) and enchantmentBonusesOf(1, level). Category 1 = Damage.",
    "display": {
      "categoryLabel": "Damage",
      "rarityLabel": "Rare"
    }
  }